{
 "name": "path-resolution",
 "family": "agent",
 "authority": "pinned Pi b7bb00b9 packages/agent/src/harness/env/nodejs.ts:51-65 resolvePath (sliced unmodified) on native Node v22.15.1 path.resolve / fileURLToPath, generated natively on Windows 11 and on Linux (node:22.15.1-bookworm-slim) by minion-agent-docs assurance/layers/data/l12-d012/gen (L12-D012, minion-agent#229)",
 "pi_revision": "b7bb00b936dbe21b8e160b3e89efdec361846699",
 "requirements": [
  "EXEC-002",
  "EXEC-005"
 ],
 "witnesses": [
  "fs_path_resolution_colon_and_drive_relative"
 ],
 "platforms": [
  "linux",
  "win32"
 ],
 "notes": "spec/execution.md section 3.2 (DIRECT_PI_PARITY), unchanged; record 12-l12-d012-path-colon.md. Lexical ctx.fs.absolute_path only: never create, write or use as a cwd any of these paths. baseline cases run in-process under VERIFIED preconditions (absent per-drive entries, process cwd drive) and REFUSE otherwise; host cases run the real resolver seam in a CHILD process whose environment block carries exactly the case's per-drive entry (and no other '='-prefixed entry) and whose cwd is a contained sandbox directory; cwd_drive / cwd_tail parts are filled from that child cwd.",
 "path_resolution": {
  "cases": [
   {
    "id": "win32/baseline/01",
    "platform": "win32",
    "provider_cwd": {
     "utf16": [
      67,
      58,
      92,
      120
     ]
    },
    "input": {
     "utf16": [
      102,
      105,
      108,
      101,
      58,
      47,
      47,
      47,
      67,
      58,
      47,
      97,
      37,
      50,
      70,
      98
     ]
    },
    "host": null,
    "preconditions": {
     "absent_entries": [
      "A",
      "X"
     ],
     "process_cwd_drive_not": [
      "A",
      "X",
      "C"
     ]
    },
    "expect": {
     "utf16": [
      67,
      58,
      92,
      120,
      92,
      102,
      105,
      108,
      101,
      58,
      92,
      67,
      58,
      92,
      97,
      37,
      50,
      70,
      98
     ]
    }
   },
   {
    "id": "win32/baseline/02",
    "platform": "win32",
    "provider_cwd": {
     "utf16": [
      67,
      58,
      92,
      120
     ]
    },
    "input": {
     "utf16": [
      102,
      105,
      108,
      101,
      58,
      47,
      67,
      58,
      47,
      97,
      37,
      50,
      70,
      98
     ]
    },
    "host": null,
    "preconditions": {
     "absent_entries": [
      "A",
      "X"
     ],
     "process_cwd_drive_not": [
      "A",
      "X",
      "C"
     ]
    },
    "expect": {
     "utf16": [
      67,
      58,
      92,
      120,
      92,
      102,
      105,
      108,
      101,
      58,
      92,
      67,
      58,
      92,
      97,
      37,
      50,
      70,
      98
     ]
    }
   },
   {
    "id": "win32/baseline/03",
    "platform": "win32",
    "provider_cwd": {
     "utf16": [
      67,
      58,
      92,
      120
     ]
    },
    "input": {
     "utf16": [
      102,
      105,
      108,
      101,
      58,
      97,
      37,
      50,
      70,
      98
     ]
    },
    "host": null,
    "preconditions": {
     "absent_entries": [
      "A",
      "X"
     ],
     "process_cwd_drive_not": [
      "A",
      "X",
      "C"
     ]
    },
    "expect": {
     "utf16": [
      67,
      58,
      92,
      120,
      92,
      102,
      105,
      108,
      101,
      58,
      97,
      37,
      50,
      70,
      98
     ]
    }
   },
   {
    "id": "win32/baseline/04",
    "platform": "win32",
    "provider_cwd": {
     "utf16": [
      67,
      58,
      92,
      120
     ]
    },
    "input": {
     "utf16": [
      102,
      105,
      108,
      101,
      58,
      47,
      47,
      47,
      116,
      109,
      112,
      47,
      97,
      37,
      50,
      70,
      98
     ]
    },
    "host": null,
    "preconditions": {
     "absent_entries": [
      "A",
      "X"
     ],
     "process_cwd_drive_not": [
      "A",
      "X",
      "C"
     ]
    },
    "expect": {
     "utf16": [
      67,
      58,
      92,
      120,
      92,
      102,
      105,
      108,
      101,
      58,
      92,
      116,
      109,
      112,
      92,
      97,
      37,
      50,
      70,
      98
     ]
    }
   },
   {
    "id": "win32/baseline/05",
    "platform": "win32",
    "provider_cwd": {
     "utf16": [
      67,
      58,
      92,
      120
     ]
    },
    "input": {
     "utf16": [
      102,
      105,
      108,
      101,
      58,
      120,
      47,
      121,
      37,
      50,
      70,
      122
     ]
    },
    "host": null,
    "preconditions": {
     "absent_entries": [
      "A",
      "X"
     ],
     "process_cwd_drive_not": [
      "A",
      "X",
      "C"
     ]
    },
    "expect": {
     "utf16": [
      67,
      58,
      92,
      120,
      92,
      102,
      105,
      108,
      101,
      58,
      120,
      92,
      121,
      37,
      50,
      70,
      122
     ]
    }
   },
   {
    "id": "win32/baseline/06",
    "platform": "win32",
    "provider_cwd": {
     "utf16": [
      67,
      58,
      92,
      120
     ]
    },
    "input": {
     "utf16": [
      120,
      47,
      99,
      58,
      47,
      100
     ]
    },
    "host": null,
    "preconditions": {
     "absent_entries": [
      "A",
      "X"
     ],
     "process_cwd_drive_not": [
      "A",
      "X",
      "C"
     ]
    },
    "expect": {
     "utf16": [
      67,
      58,
      92,
      120,
      92,
      120,
      92,
      99,
      58,
      92,
      100
     ]
    }
   },
   {
    "id": "win32/baseline/07",
    "platform": "win32",
    "provider_cwd": {
     "utf16": [
      67,
      58,
      92,
      120
     ]
    },
    "input": {
     "utf16": [
      120,
      92,
      99,
      58,
      92,
      100
     ]
    },
    "host": null,
    "preconditions": {
     "absent_entries": [
      "A",
      "X"
     ],
     "process_cwd_drive_not": [
      "A",
      "X",
      "C"
     ]
    },
    "expect": {
     "utf16": [
      67,
      58,
      92,
      120,
      92,
      120,
      92,
      99,
      58,
      92,
      100
     ]
    }
   },
   {
    "id": "win32/baseline/08",
    "platform": "win32",
    "provider_cwd": {
     "utf16": [
      67,
      58,
      92,
      120
     ]
    },
    "input": {
     "utf16": [
      99,
      58,
      100
     ]
    },
    "host": null,
    "preconditions": {
     "absent_entries": [
      "A",
      "X"
     ],
     "process_cwd_drive_not": [
      "A",
      "X",
      "C"
     ]
    },
    "expect": {
     "utf16": [
      99,
      58,
      92,
      120,
      92,
      100
     ]
    }
   },
   {
    "id": "win32/baseline/09",
    "platform": "win32",
    "provider_cwd": {
     "utf16": [
      67,
      58,
      92,
      120
     ]
    },
    "input": {
     "utf16": [
      120,
      47,
      99,
      58
     ]
    },
    "host": null,
    "preconditions": {
     "absent_entries": [
      "A",
      "X"
     ],
     "process_cwd_drive_not": [
      "A",
      "X",
      "C"
     ]
    },
    "expect": {
     "utf16": [
      67,
      58,
      92,
      120,
      92,
      120,
      92,
      99,
      58
     ]
    }
   },
   {
    "id": "win32/baseline/10",
    "platform": "win32",
    "provider_cwd": {
     "utf16": [
      67,
      58,
      92,
      120
     ]
    },
    "input": {
     "utf16": [
      120,
      47,
      99,
      58,
      47
     ]
    },
    "host": null,
    "preconditions": {
     "absent_entries": [
      "A",
      "X"
     ],
     "process_cwd_drive_not": [
      "A",
      "X",
      "C"
     ]
    },
    "expect": {
     "utf16": [
      67,
      58,
      92,
      120,
      92,
      120,
      92,
      99,
      58
     ]
    }
   },
   {
    "id": "win32/baseline/11",
    "platform": "win32",
    "provider_cwd": {
     "utf16": [
      67,
      58,
      92,
      120
     ]
    },
    "input": {
     "utf16": [
      120,
      47,
      99,
      58,
      100,
      47,
      101
     ]
    },
    "host": null,
    "preconditions": {
     "absent_entries": [
      "A",
      "X"
     ],
     "process_cwd_drive_not": [
      "A",
      "X",
      "C"
     ]
    },
    "expect": {
     "utf16": [
      67,
      58,
      92,
      120,
      92,
      120,
      92,
      99,
      58,
      100,
      92,
      101
     ]
    }
   },
   {
    "id": "win32/baseline/12",
    "platform": "win32",
    "provider_cwd": {
     "utf16": [
      67,
      58,
      92,
      120
     ]
    },
    "input": {
     "utf16": [
      97,
      58,
      58,
      47,
      98
     ]
    },
    "host": null,
    "preconditions": {
     "absent_entries": [
      "A",
      "X"
     ],
     "process_cwd_drive_not": [
      "A",
      "X",
      "C"
     ]
    },
    "expect": {
     "utf16": [
      97,
      58,
      92,
      58,
      92,
      98
     ]
    }
   },
   {
    "id": "win32/baseline/13",
    "platform": "win32",
    "provider_cwd": {
     "utf16": [
      67,
      58,
      92,
      120
     ]
    },
    "input": {
     "utf16": [
      120,
      47,
      58,
      47,
      121
     ]
    },
    "host": null,
    "preconditions": {
     "absent_entries": [
      "A",
      "X"
     ],
     "process_cwd_drive_not": [
      "A",
      "X",
      "C"
     ]
    },
    "expect": {
     "utf16": [
      67,
      58,
      92,
      120,
      92,
      120,
      92,
      58,
      92,
      121
     ]
    }
   },
   {
    "id": "win32/baseline/14",
    "platform": "win32",
    "provider_cwd": {
     "utf16": [
      67,
      58,
      92,
      120
     ]
    },
    "input": {
     "utf16": [
      58
     ]
    },
    "host": null,
    "preconditions": {
     "absent_entries": [
      "A",
      "X"
     ],
     "process_cwd_drive_not": [
      "A",
      "X",
      "C"
     ]
    },
    "expect": {
     "utf16": [
      67,
      58,
      92,
      120,
      92,
      58
     ]
    }